{
  "id": "wechat",
  "version": 1,
  "name": {
    "en": "WeChat",
    "zh-Hans": "微信"
  },
  "url": "https://wx.qq.com/",
  "category": "social",
  "description": {
    "en": "WeChat on the web, signed in by scanning a QR code each time",
    "zh-Hans": "网页版微信，每次打开都要扫码登录"
  },
  "icon": "https://res.wx.qq.com/a/wx_fed/assets/res/OTE0YTAw.png",
  "window": {
    "width": 1000,
    "height": 720,
    "incognito": true
  }
}
