{
  "id": "readwise-reader",
  "version": 1,
  "name": {
    "en": "Readwise Reader",
    "zh-Hans": "Readwise Reader"
  },
  "url": "https://read.readwise.io/",
  "category": "reading",
  "description": {
    "en": "Save articles and read them later",
    "zh-Hans": "收藏文章，稍后阅读"
  },
  "icon": "https://is1-ssl.mzstatic.com/image/thumb/Purple221/v4/a9/cc/3d/a9cc3d06-038b-0212-1555-2a9fa1932acf/AppIcon-0-0-1x_U007epad-0-1-85-220.png/1024x1024bb.png"
}
