{
  "id": "figma",
  "version": 1,
  "name": {
    "en": "Figma",
    "zh-Hans": "Figma"
  },
  "url": "https://www.figma.com/",
  "category": "productivity",
  "description": {
    "en": "Design interfaces together",
    "zh-Hans": "多人协作的界面设计工具"
  },
  "icon": "https://static.figma.com/app/icon/2/icon-512.png"
}
