{
  "id": "devdocs",
  "version": 1,
  "name": {
    "en": "DevDocs",
    "zh-Hans": "DevDocs"
  },
  "url": "https://devdocs.io/",
  "category": "developer",
  "description": {
    "en": "API docs for many languages in one place",
    "zh-Hans": "多种语言和框架的 API 文档合集"
  },
  "icon": "https://devdocs.io/images/apple-icon-160.png"
}
